[
  {
    "date": "01/01/2025",
    "hearingTime": "10:30am",
    "caseReferenceNumber": "GRC/2025/001",
    "caseName": "A Vs B",
    "judges": "Judge Smith",
    "members": "Member One",
    "modeOfHearing": "Oral Hearing",
    "venue": "GRC Hearing Centre",
    "additionalInformation": "No additional information"
  }
]
